{
  "$schema": "./schemas/plant-status.schema.json",
  "schema_version": "invatrace.catalogue.plant-status.v1",
  "catalogue_version": "2.0.0",
  "model_version": "invatrace-student33-v6-epoch2-320-fp16",
  "last_reviewed": "2026-09-13",
  "class_count": 32,
  "records": [
    {
      "species_id": "acacia-auriculiformis",
      "model_label": "acacia_auriculiformis",
      "class_index": 0,
      "scientific_name": "Acacia auriculiformis",
      "common_name": "Earleaf acacia",
      "ui_state": "invasive",
      "general_information": "The MyBIS invasive-plant record lists occurrence in Perak, Selangor and Terengganu.",
      "safety_message": "Photograph the leaves, bark and pods without disturbing the plant; record the location and report it. Do not cut or remove it without site permission.",
      "status_source_ids": [
        "mybis-08793"
      ],
      "status_reviewed_at": "2026-09-08",
      "report_eligible": true
    },
    {
      "species_id": "acacia-mangium",
      "model_label": "acacia_mangium",
      "class_index": 1,
      "scientific_name": "Acacia mangium",
      "common_name": "Mangium",
      "ui_state": "invasive",
      "general_information": "The Department of Agriculture Malaysia factsheet records the species in Peninsular Malaysia, Sabah and Sarawak.",
      "safety_message": "Record bark, phyllodes and pods from a safe position and report the mapped point. Tree work or seed handling requires the land manager's permission.",
      "status_source_ids": [
        "doa-ias-2025"
      ],
      "status_reviewed_at": "2026-09-08",
      "report_eligible": true
    },
    {
      "species_id": "arachis-pintoi",
      "model_label": "arachis_pintoi",
      "class_index": 2,
      "scientific_name": "Arachis pintoi",
      "common_name": "Pinto peanut",
      "ui_state": "invasive",
      "general_information": "The MyBIS invasive-plant record lists occurrence in the Federal Territory of Putrajaya.",
      "safety_message": "Photograph flowers, four-part leaves and runners, then report the location. Because it may be deliberately planted, do not remove it without explicit permission.",
      "status_source_ids": [
        "mybis-31095"
      ],
      "status_reviewed_at": "2026-09-08",
      "report_eligible": true
    },
    {
      "species_id": "asclepias-curassavica",
      "model_label": "asclepias_curassavica",
      "class_index": 3,
      "scientific_name": "Asclepias curassavica",
      "common_name": "Tropical milkweed",
      "ui_state": "invasive",
      "general_information": "GRIIS Malaysia marks the species invasive, alien and present in Malaysia.",
      "safety_message": "Avoid sap contact and do not open pods. Photograph the flowers and leaves, record the location and obtain permission before any handling.",
      "status_source_ids": [
        "griis-91528"
      ],
      "status_reviewed_at": "2026-09-08",
      "report_eligible": true
    },
    {
      "species_id": "bidens-pilosa",
      "model_label": "bidens_pilosa",
      "class_index": 4,
      "scientific_name": "Bidens pilosa",
      "common_name": "Beggarticks",
      "ui_state": "invasive",
      "general_information": "GRIIS Malaysia marks the species invasive, alien and present in Malaysia.",
      "safety_message": "Photograph before touching it and avoid carrying barbed seed. Report the location; only remove an authorised small plant before seed forms.",
      "status_source_ids": [
        "griis-91537"
      ],
      "status_reviewed_at": "2026-09-08",
      "report_eligible": true
    },
    {
      "species_id": "calopogonium-mucunoides",
      "model_label": "calopogonium_mucunoides",
      "class_index": 5,
      "scientific_name": "Calopogonium mucunoides",
      "common_name": "Calopo",
      "ui_state": "invasive",
      "general_information": "GRIIS Malaysia marks the species invasive, alien and present in Malaysia.",
      "safety_message": "Photograph leaves, flowers and pods without pulling vines through surrounding plants. Record and report the location, and wait for site authorisation.",
      "status_source_ids": [
        "griis-91550"
      ],
      "status_reviewed_at": "2026-09-08",
      "report_eligible": true
    },
    {
      "species_id": "cecropia-peltata",
      "model_label": "cecropia_peltata",
      "class_index": 6,
      "scientific_name": "Cecropia peltata",
      "common_name": "Trumpet tree",
      "ui_state": "invasive",
      "general_information": "GRIIS Malaysia marks the species invasive, alien and present in Malaysia.",
      "safety_message": "Photograph leaf shape, trunk scars and fruit from safe ground. Do not fell or prune the tree; report it to the responsible land manager.",
      "status_source_ids": [
        "griis-91557"
      ],
      "status_reviewed_at": "2026-09-08",
      "report_eligible": true
    },
    {
      "species_id": "chromolaena-odorata",
      "model_label": "chromolaena_odorata",
      "class_index": 7,
      "scientific_name": "Chromolaena odorata",
      "common_name": "Siam weed",
      "ui_state": "invasive",
      "general_information": "GRIIS Malaysia marks the species invasive, alien and present in Malaysia.",
      "safety_message": "Do not cut a flowering or seeding stand. Photograph it, record the point and report it; remove only under an authorised site plan.",
      "status_source_ids": [
        "griis-91571"
      ],
      "status_reviewed_at": "2026-09-08",
      "report_eligible": true
    },
    {
      "species_id": "cleome-rutidosperma",
      "model_label": "cleome_rutidosperma",
      "class_index": 8,
      "scientific_name": "Cleome rutidosperma",
      "common_name": "Fringed spiderflower",
      "ui_state": "invasive",
      "general_information": "The MyBIS invasive-plant record lists occurrence in the Federal Territory of Kuala Lumpur.",
      "safety_message": "Photograph the three-part leaves, flowers and capsules and submit a location report. Do not weed it from land you do not manage.",
      "status_source_ids": [
        "mybis-33864"
      ],
      "status_reviewed_at": "2026-09-08",
      "report_eligible": true
    },
    {
      "species_id": "cynodon-dactylon",
      "model_label": "cynodon_dactylon",
      "class_index": 9,
      "scientific_name": "Cynodon dactylon",
      "common_name": "Bermuda grass",
      "ui_state": "invasive",
      "general_information": "GRIIS Malaysia marks the species invasive, alien and present in Malaysia.",
      "safety_message": "Photograph runners and seed heads and report the patch. Do not spread cut runners or soil, and only control it with the land manager's approval.",
      "status_source_ids": [
        "griis-91612"
      ],
      "status_reviewed_at": "2026-09-08",
      "report_eligible": true
    },
    {
      "species_id": "cyperus-rotundus",
      "model_label": "cyperus_rotundus",
      "class_index": 10,
      "scientific_name": "Cyperus rotundus",
      "common_name": "Purple nutsedge",
      "ui_state": "invasive",
      "general_information": "GRIIS Malaysia marks the species invasive, alien and present in Malaysia in terrestrial and freshwater habitats.",
      "safety_message": "Photograph stems and flower clusters and record the patch. Do not move contaminated soil or attempt removal without an approved plan for the tubers.",
      "status_source_ids": [
        "griis-91613"
      ],
      "status_reviewed_at": "2026-09-08",
      "report_eligible": true
    },
    {
      "species_id": "eichhornia-crassipes",
      "model_label": "eichhornia_crassipes",
      "class_index": 11,
      "scientific_name": "Eichhornia crassipes",
      "common_name": "Water hyacinth",
      "ui_state": "invasive",
      "general_information": "GRIIS Malaysia marks the species invasive, alien and present in freshwater; the Sabah strategy also records it in Sabah.",
      "safety_message": "Stay on stable ground, photograph the mat and record the location. Never enter water or return fragments to it; report the infestation for authorised control.",
      "status_source_ids": [
        "griis-91626",
        "sabah-biodiversity-strategy"
      ],
      "status_reviewed_at": "2026-09-08",
      "report_eligible": true
    },
    {
      "species_id": "eleusine-indica",
      "model_label": "eleusine_indica",
      "class_index": 12,
      "scientific_name": "Eleusine indica",
      "common_name": "Goosegrass",
      "ui_state": "invasive",
      "general_information": "The MyBIS invasive-plant record lists occurrence in Johor, Pahang, Selangor and Putrajaya.",
      "safety_message": "Photograph the flattened base and seed spikes and report the patch. Avoid transporting seeding material or contaminated soil; obtain permission before control.",
      "status_source_ids": [
        "mybis-17187"
      ],
      "status_reviewed_at": "2026-09-08",
      "report_eligible": true
    },
    {
      "species_id": "impatiens-balsamina",
      "model_label": "impatiens_balsamina",
      "class_index": 13,
      "scientific_name": "Impatiens balsamina",
      "common_name": "Garden balsam",
      "ui_state": "invasive",
      "general_information": "The MyBIS invasive-plant record lists occurrence in Selangor and Putrajaya.",
      "safety_message": "Photograph flowers, leaves and capsules and report the location. Because it may be cultivated and capsules disperse seed explosively, do not remove it without permission.",
      "status_source_ids": [
        "mybis-55581"
      ],
      "status_reviewed_at": "2026-09-08",
      "report_eligible": true
    },
    {
      "species_id": "leucaena-leucocephala",
      "model_label": "leucaena_leucocephala",
      "class_index": 14,
      "scientific_name": "Leucaena leucocephala",
      "common_name": "Leucaena",
      "ui_state": "invasive",
      "general_information": "The Department of Agriculture Malaysia factsheet records the species in Peninsular Malaysia, Sabah and Sarawak.",